{
  "schema": "spectre/v1",
  "tool": "clickspectre",
  "version": "1.0.2",
  "timestamp": "2026-02-23T10:00:00Z",
  "target": {
    "type": "clickhouse",
    "uri_hash": "sha256:ch123"
  },
  "findings": [
    {
      "id": "UNUSED_TABLE",
      "severity": "high",
      "location": "analytics.dead_events",
      "message": "zero reads/writes in 90 days, not replicated"
    },
    {
      "id": "UNUSED_TABLE",
      "severity": "medium",
      "location": "analytics.old_metrics",
      "message": "zero reads/writes in 90 days, replicated"
    }
  ],
  "summary": {
    "total": 2,
    "high": 1,
    "medium": 1,
    "low": 0,
    "info": 0
  }
}
